{
	"$schema": "../../schemas/common.schema.json",
	"a11y": {
		"main_content": "Main content",
		"scroll_to_top": "Scroll to top",
		"skip_to_content": "Skip to main content"
	},
	"blog": {
		"rss": "RSS"
	},
	"common": {
		"appearance": "Appearance",
		"cancel": "Cancel",
		"confirm": "Confirm",
		"copied": "Copied!",
		"dark": "Dark",
		"disabled": "Disabled",
		"enabled": "Enabled",
		"error": "Error",
		"experimental": "Experimental",
		"language": "Language",
		"learn_more": "Learn more",
		"light": "Light",
		"loading": "Loading...",
		"midnight": "Midnight",
		"midnight_experimental": "Midnight (experimental)",
		"na": "N/A",
		"none": "None",
		"please_try_again": "Please try again.",
		"retry": "Try Again",
		"save_failed": "Save Failed",
		"search": "Search...",
		"system": "System"
	},
	"footer": {
		"blog": "Blog",
		"changelog": "Changelog",
		"column_links": "Footer {label} links",
		"community": "Community",
		"copyright": "WolfStar Project — Copyright © {year}. All rights reserved.",
		"discord_aria": "Join the WolfStar Discord - opens in new tab",
		"features": "Features",
		"github": "GitHub",
		"github_aria": "Visit WolfStar on GitHub - opens in new tab",
		"legal": "Legal",
		"logo": "WolfStar logo",
		"other_apps": "Other Apps",
		"powered_by_netlify": "Powered by Netlify",
		"powered_by_netlify_aria": "Powered by Netlify - opens in new tab",
		"privacy": "Privacy Policy",
		"product": "Product",
		"site_footer": "Site footer",
		"social_links": "Social links",
		"support_server": "Support Server",
		"tagline": "A fully customizable, multilingual Discord moderation app. Free forever, open source.",
		"terms": "Terms of Use",
		"x_aria": "Follow WolfStar on X - opens in new tab"
	},
	"header": {
		"account_loading": "",
		"add_app": "Add App",
		"brand": "WolfStar",
		"dashboard": "",
		"home": "{name} home",
		"settings": "Settings",
		"sign_in": "Sign in",
		"sign_in_discord": "Sign in with Discord",
		"sign_out": "Sign out",
		"site_header": "Site header",
		"user_menu": "User menu"
	},
	"i18n": {
		"edit_on_github": "Edit on GitHub",
		"missing_keys": "No missing keys | 1 missing key | {count} missing keys"
	},
	"nav": {
		"advanced_logging": "Advanced Logging",
		"advanced_logging_description": "Track and log events in your server",
		"applications": "Applications",
		"blog": "Blog",
		"changelog": "Changelog",
		"commands": "Commands",
		"features": "Features",
		"github": "GitHub",
		"main_navigation": "Main navigation",
		"mobile_menu": "Mobile menu",
		"mobile_navigation": "Mobile navigation",
		"moderation_logs": "Moderation Logs",
		"moderation_logs_description": "Searchable moderation history for every action",
		"moderation_tools": "Moderation Tools",
		"moderation_tools_description": "Tools to help you moderate your server",
		"staryl_description": "",
		"wolfstar_description": ""
	},
	"nuxtSiteConfig": {
		"description": "",
		"name": ""
	},
	"translation_status": {
		"description": "Track how complete each locale is and contribute missing strings.",
		"generated_at": "Last generated {date}",
		"no_data": "Translation status is not available yet. Build the Lunaria dashboard to generate it.",
		"progress_by_locale": "Progress by locale",
		"source_locale": "Source locale",
		"title": "Translation Status"
	},
	"user_menu": {
		"report_bug": "Report a Bug",
		"sign_out": "Sign out"
	}
}
