{
	"$schema": "../../schemas/common.schema.json",
	"a11y": {
		"main_content": "Contenuto principale",
		"scroll_to_top": "Torna su",
		"skip_to_content": "Vai al contenuto principale"
	},
	"blog": {
		"article_links": "Link dell'articolo",
		"avatar_alt": "Avatar di {name}",
		"back": "Torna al blog",
		"copy_url": "Copia URL",
		"edit_article": "Modifica questo articolo",
		"image_alt": "Immagine di {title}",
		"join_support": "Entra nel server di supporto",
		"link_copied": "Link copiato negli appunti",
		"links": "Link",
		"on_platform": "WolfStar su {platform}",
		"rss": "RSS",
		"star_github": "Metti una stella su GitHub",
		"toc": "Indice"
	},
	"changelog": {
		"back": "Torna al registro delle modifiche",
		"cover_alt": "Copertina di {title}",
		"description": "Segui ogni versione, miglioramento e correzione del WolfStar Project.",
		"empty": "Non è ancora stata pubblicata nessuna versione.",
		"github_releases": "Versioni su GitHub",
		"title": "Registro delle modifiche"
	},
	"common": {
		"appearance": "Aspetto",
		"cancel": "Annulla",
		"confirm": "Conferma",
		"copied": "Copiato!",
		"dark": "Scuro",
		"disabled": "Disattivato",
		"enabled": "Attivato",
		"error": "Errore",
		"experimental": "Sperimentale",
		"language": "Lingua",
		"learn_more": "Scopri di più",
		"light": "Chiaro",
		"loading": "Caricamento...",
		"midnight": "Mezzanotte",
		"midnight_experimental": "Mezzanotte (sperimentale)",
		"na": "N/D",
		"none": "Nessuno",
		"please_try_again": "Riprova.",
		"retry": "Riprova",
		"save_failed": "Salvataggio non riuscito",
		"search": "Cerca...",
		"system": "Sistema"
	},
	"footer": {
		"blog": "Blog",
		"changelog": "Registro delle modifiche",
		"column_links": "Link del piè di pagina {label}",
		"community": "Community",
		"copyright": "WolfStar Project — Copyright © {year}. Tutti i diritti riservati.",
		"discord_aria": "Unisciti al Discord di WolfStar - si apre in una nuova scheda",
		"features": "Funzionalità",
		"github": "GitHub",
		"github_aria": "Visita WolfStar su GitHub - si apre in una nuova scheda",
		"legal": "Note legali",
		"logo": "Logo WolfStar",
		"other_apps": "Altre app",
		"powered_by_netlify": "Con tecnologia Netlify",
		"powered_by_netlify_aria": "Con tecnologia Netlify - si apre in una nuova scheda",
		"privacy": "Informativa sulla privacy",
		"product": "Prodotto",
		"site_footer": "Piè di pagina del sito",
		"social_links": "Link social",
		"support_server": "Server di supporto",
		"tagline": "Un'app di moderazione Discord completamente personalizzabile e multilingue. Gratis per sempre, open source.",
		"terms": "Termini di utilizzo",
		"x_aria": "Segui WolfStar su X - si apre in una nuova scheda"
	},
	"header": {
		"account_loading": "Caricamento del tuo account",
		"add_app": "Aggiungi app",
		"brand": "WolfStar",
		"dashboard": "Dashboard",
		"home": "Home di {name}",
		"settings": "Impostazioni",
		"sign_in": "Accedi",
		"sign_in_discord": "Accedi con Discord",
		"sign_out": "Esci",
		"site_header": "Intestazione del sito",
		"user_menu": "Menu utente"
	},
	"i18n": {
		"edit_on_github": "Modifica su GitHub",
		"missing_keys": "Nessuna chiave mancante | 1 chiave mancante | {count} chiavi mancanti"
	},
	"nav": {
		"advanced_logging": "Logging avanzato",
		"advanced_logging_description": "Traccia e registra gli eventi nel tuo server",
		"applications": "Applicazioni",
		"blog": "Blog",
		"changelog": "Registro delle modifiche",
		"commands": "Comandi",
		"features": "Funzionalità",
		"github": "GitHub",
		"main_navigation": "Navigazione principale",
		"mobile_menu": "Menu mobile",
		"mobile_navigation": "Navigazione mobile",
		"moderation_logs": "Log di moderazione",
		"moderation_logs_description": "Cronologia di moderazione ricercabile per ogni azione",
		"moderation_tools": "Strumenti di moderazione",
		"moderation_tools_description": "Strumenti per aiutarti a moderare il tuo server",
		"staryl_description": "Aggiornamenti social per Discord",
		"wolfstar_description": "Moderazione, con ogni azione registrata"
	},
	"nuxtSiteConfig": {
		"description": "WolfStar offre ai team di moderazione di Discord un'AutoMod configurabile, una cronologia consultabile di moderazione e comandi, e un'unica dashboard per le impostazioni del server.",
		"name": "WolfStar"
	},
	"translation_status": {
		"description": "Controlla quanto è completa ogni lingua e contribuisci con le stringhe mancanti.",
		"generated_at": "Ultima generazione {date}",
		"no_data": "Lo stato delle traduzioni non è ancora disponibile. Genera la dashboard Lunaria per crearlo.",
		"progress_by_locale": "Progresso per lingua",
		"source_locale": "Lingua di origine",
		"title": "Stato delle traduzioni"
	},
	"user_menu": {
		"report_bug": "Segnala un bug",
		"sign_out": "Esci"
	}
}
