{
	"$schema": "../../schemas/common.schema.json",
	"a11y": {
		"main_content": "Contenido principal",
		"scroll_to_top": "Scroll to top",
		"skip_to_content": "Saltar al contenido principal"
	},
	"blog": {
		"article_links": "",
		"avatar_alt": "",
		"back": "",
		"copy_url": "",
		"edit_article": "",
		"image_alt": "",
		"join_support": "",
		"link_copied": "",
		"links": "",
		"on_platform": "",
		"rss": "RSS",
		"star_github": "",
		"toc": ""
	},
	"changelog": {
		"back": "",
		"cover_alt": "",
		"description": "",
		"empty": "",
		"github_releases": "",
		"title": ""
	},
	"common": {
		"appearance": "Apariencia",
		"cancel": "Cancelar",
		"confirm": "Confirmar",
		"copied": "¡Copiado!",
		"dark": "Oscuro",
		"disabled": "Desactivado",
		"enabled": "Activado",
		"error": "Error",
		"experimental": "Experimental",
		"language": "Idioma",
		"learn_more": "Más información",
		"light": "Claro",
		"loading": "Cargando...",
		"midnight": "Midnight",
		"midnight_experimental": "Midnight (experimental)",
		"na": "N/D",
		"none": "Ninguno",
		"please_try_again": "Por favor, inténtalo de nuevo.",
		"retry": "Intentar de nuevo",
		"save_failed": "Error al guardar",
		"search": "Buscar...",
		"system": "System"
	},
	"footer": {
		"blog": "Blog",
		"changelog": "Registro de cambios",
		"column_links": "Enlaces del pie de página de {label}",
		"community": "Comunidad",
		"copyright": "WolfStar Project — Copyright © {year}. Todos los derechos reservados.",
		"discord_aria": "Únete al Discord de WolfStar - se abre en una pestaña nueva",
		"features": "Funciones",
		"github": "GitHub",
		"github_aria": "Visita WolfStar en GitHub - se abre en una pestaña nueva",
		"legal": "Aviso legal",
		"logo": "Logo de WolfStar",
		"other_apps": "Otras apps",
		"powered_by_netlify": "Con tecnología de Netlify",
		"powered_by_netlify_aria": "Con tecnología de Netlify - se abre en una pestaña nueva",
		"privacy": "Política de privacidad",
		"product": "Producto",
		"site_footer": "Pie de página del sitio",
		"social_links": "Enlaces sociales",
		"support_server": "Servidor de soporte",
		"tagline": "Una app de moderación de Discord totalmente personalizable y multilingüe. Gratis para siempre, de código abierto.",
		"terms": "Términos de uso",
		"x_aria": "Sigue a WolfStar en X - se abre en una pestaña nueva"
	},
	"header": {
		"account_loading": "",
		"add_app": "Añadir app",
		"brand": "WolfStar",
		"dashboard": "",
		"home": "Inicio de {name}",
		"settings": "Settings",
		"sign_in": "Iniciar sesión",
		"sign_in_discord": "Iniciar sesión con Discord",
		"sign_out": "Cerrar sesión",
		"site_header": "Cabecera del sitio",
		"user_menu": "Menú de usuario"
	},
	"i18n": {
		"edit_on_github": "Editar en GitHub",
		"missing_keys": "Ninguna clave faltante | 1 clave faltante | {count} claves faltantes"
	},
	"nav": {
		"advanced_logging": "Registro avanzado",
		"advanced_logging_description": "Rastrea y registra eventos en tu servidor",
		"applications": "Aplicaciones",
		"blog": "Blog",
		"changelog": "Registro de cambios",
		"commands": "Comandos",
		"features": "Funciones",
		"github": "GitHub",
		"main_navigation": "Navegación principal",
		"mobile_menu": "Menú móvil",
		"mobile_navigation": "Navegación móvil",
		"moderation_logs": "Registros de moderación",
		"moderation_logs_description": "Historial de moderación con búsqueda para cada acción",
		"moderation_tools": "Herramientas de moderación",
		"moderation_tools_description": "Herramientas para ayudarte a moderar tu servidor",
		"staryl_description": "",
		"wolfstar_description": ""
	},
	"nuxtSiteConfig": {
		"description": "",
		"name": ""
	},
	"translation_status": {
		"description": "Consulta qué tan completa está cada lengua y contribuye con las cadenas que falten.",
		"generated_at": "Última generación {date}",
		"no_data": "El estado de las traducciones aún no está disponible. Genera el panel de Lunaria para crearlo.",
		"progress_by_locale": "Progreso por idioma",
		"source_locale": "Idioma de origen",
		"title": "Estado de las traducciones"
	},
	"user_menu": {
		"report_bug": "Informar de un error",
		"sign_out": "Cerrar sesión"
	}
}
